ID,Category,ISBN,Title,Author,Editon,Description,Price,Genre
2008,Autobiography and memoir,9780316465785,Hillbilly Elegy: A Memoir of a Family and Culture in Crisis,J.D. Vance,Reprint edition; 2018; HarperCollins,A memoir about growing up in a poor white Appalachian community and the social and economic issues facing that region,$16.99,Autobiography and Memoir / Personal Memoirs / Social Issues
2009,Autobiography and memoir,9780525429037,The Year of Magical Thinking,Joan Didion,1st edition; 2005; Knopf,A memoir by the author about the year following the death of her husband and the illness of her daughter,$23.95,Autobiography and Memoir / Personal Memoirs / Grief
2010,Autobiography and memoir,9781455547129,Shoe Dog: A Memoir by the Creator of Nike,Phil Knight,Reprint edition; 2018; Scribner,A memoir by the co-founder of Nike about the early days of the company and his journey to becoming a successful entrepreneur,$20.00,Autobiography and Memoir / Business Personal Memoirs
2101,Biography,9781476772668,Leonardo da Vinci,Walter Isaacson,Reprint edition; 2018; Simon & Schuster,A biography of the Italian Renaissance artist and inventor,$22.00,Biography Artists / Architects / and Photographers
2102,Biography,9780812980664,Steve Jobs,Walter Isaacson,Reprint edition; 2013; Simon & Schuster,A biography of the co-founder of Apple Inc. and his impact on the technology industry,$20.00,Biography Business
2103,Biography,9780345804575,The Rise of Theodore Roosevelt,Rebecca Skloot,Reprint edition; 2011; Crown Publishing Group,A biography of the woman whose cancer cells were used for scientific research without her consent,$18.00,Biography Medical
2104,Biography,9780735223001,Churchill: Walking with Destiny,Andrew Roberts,1st edition; 2018; Viking,A biography of the British statesman Winston Churchill,$40.00,Biography Political
2105,Biography,9780061122415,John Adams,David McCullough,Reprint edition; 2008; Simon & Schuster,A biography of the second president of the United States,$20.00,Biography Political
2106,Biography,9780316055448,Unbroken: A World War II Story of Survival Resilience and Redemption,Laura Hillenbrand,Reprint edition; 2014; Random House,A biography of the Olympic athlete and World War II veteran Louis Zamperini,$17.00,Biography Military
2107,Biography,9780060731328,Benjamin Franklin: An American Life,Walter Isaacson,Reprint edition; 2004; Simon & Schuster,A biography of the founding father and inventor,$20.00,Biography Political
2108,Biography,9781594204600,Alexander Hamilton,Ron Chernow,Reprint edition; 2005; Penguin Press,A biography of the founding father and first Secretary of the Treasury,$20.00,Biography Political
2109,Biography,9780345804384,The Stranger in the Woods: The Extraordinary Story of the Last True Hermit,Michael Finkel,Reprint edition; 2018; Vintage Books,A biography of Christopher Knight who lived alone in the woods of Maine for 27 years,$16.95,Biography Adventurers and Explorers
2110,Biography,9781400067669,The Hemingses of Monticello: An American Family,Annette Gordon-Reed,Reprint edition; 2018; Vintage Books,A biography of Christopher Knight who lived alone in the woods of Maine for 27 years,$16.95,Biography Adventurers and Explorers
2201,Essays,9780374531386,Slouching Towards Bethlehem,Joan Didion,Reprint edition; 2008; Farrar; Straus and Giroux,A collection of essays exploring American culture in the 1960s,$9.79,Personal Essays
2202,Essays,9780374522216,The White Album,Joan Didion,1st edition; 2000; Picador,A collection of essays examining politics culture and personal experience in the 1970s,$10.99,Personal Essays
2203,Essays,9781503260143,The Souls of Black Folk,W.E.B. Du Bois,2014 edition; CreateSpace Independent Publishing Platform,A groundbreaking collection of essays on race politics and society by one of America's most influential black intellectuals,$6.99,Cultural Criticism
2204,Essays,9780807006173,Notes of a Native Son,James Baldwin,2012 edition; Beacon Press,A collection of essays examining the experience of being black in America as well as broader themes of identity and social justice,$11.55,Personal Essays
2205,Essays,9780618155873,The Best American Essays of the Century,Joyce Carol Oates,1st edition; 2001; Mariner Books,A collection of the most significant and influential essays of the 20th century selected by one of America's foremost writers,$17.00,Anthology
2206,Essays,9780385422985,The Art of the Personal Essay,Phillip Lopate,Reprint edition; 1995; Anchor Books,A comprehensive anthology of the genre featuring essays from some of the greatest writers of all time,$12.89,Writing
2207,Essays,9780316776967,Me Talk Pretty One Day,David Sedaris,1st edition; 2000; Little; Brown and Company,A hilarious and poignant collection of essays on family culture and identity by the bestselling humorist,$11.89,Humor
2208,Essays,9781555976718,The Empathy Exams,Leslie Jamison,Reprint edition; 2018; Graywolf Press,A thought-provoking collection of essays exploring the nature of human connection and the power of empathy,$14.49,Cultural Criticism
2209,Essays,9780062262277,The View from the Cheap Seats,Neil Gaiman,Reprint edition; 2018; William Morrow Paperbacks,A collection of essays on a variety of subjects from writing and literature to politics and culture by one of the most popular contemporary writers,$10.99,Literary Criticism
2210,Essays,9780679744726,The Fire Next Time,James Baldwin,Reprint edition; 1992; Vintage International,A powerful and prophetic collection of essays on race religion and social justice written in the aftermath of the civil rights movement,$11.49,Cultural Criticism
2301,Self-help books,9780062315007,The Power of Now,Eckhart Tolle,1st edition; 1999; New World Library,A guide to spiritual enlightenment and living in the present moment,$9.99,Spiritual
2302,Self-help books,9781250301697,Atomic Habits,James Clear,1st edition; 2018; Avery,A practical guide to building good habits and breaking bad ones,$14.99,Personal Growth
2303,Self-help books,9780316167253,The 7 Habits of Highly Effective People,Stephen R. Covey,25th Anniversary edition; 2013; Simon & Schuster,A classic guide to personal effectiveness and leadership,$13.99,Personal Growth
2304,Self-help books,9781501179867,Girl Wash Your Face,Rachel Hollis,1st edition; 2018; Thomas Nelson,A motivational book aimed at helping women improve their lives and self-esteem,$12.00,Personal Growth
2305,Self-help books,9781591848018,The Life-Changing Magic of Tidying Up,Marie Kondo,Reprint edition; 2016; Ten Speed Press,A best-selling guide to decluttering and organizing your home and life,$11.89,Lifestyle
2306,Self-help books,9781501169370,You Are a Badass: How to Stop Doubting Your Greatness,Jen Sincero,Reprint edition; 2017; Running Press,A humorous and motivational guide to achieving your goals and living your best life,$9.99,Personal Growth
2307,Self-help books,9781401949734,The Law of Attraction: The Basics of the Teachings,Esther Hicks,1st edition; 2006; Hay House,A guide to the principles of the law of attraction and how to use them to create the life you want,$10.99,Spiritual
2308,Self-help books,9780735214149,Grit: The Power of Passion and Perseverance,Angela Duckworth,Reprint edition; 2018; Scribner,A psychologist's exploration of the role of perseverance and passion in achieving success,$12.99,Personal Growth
2309,Self-help books,9781594484803,The Happiness Project,Gretchen Rubin,Reprint edition; 2011; Harper Paperbacks,A memoir and self-help guide to finding happiness through simple changes and self-awareness,$12.89,Personal Growth
2310,Self-help books,9780062457714,Big Magic: Creative Living Beyond Fear,Elizabeth Gilbert,Reprint edition; 2016; Riverhead Books,A guide to overcoming fear and embracing creativity in all areas of life,$12.99,Personal Growth